,id,likesCount,owner/is_mentionable,owner/is_private,owner/is_verified,repliesCount,text,timestamp,sentiment,we_count,them_count
537,17876167830279268,55,True,True,False,11,"Oh Krystal, I've been a subscriber/member for several years... you have been a solid Democrat voice I have used to balance out my mosting conservative algo... but you seem to be going off the rails...",2025-03-12T15:23:21.000Z,"{'label': 'neutral', 'score': 0.47270065546035767}",1,0
538,18062861542793180,14,True,True,False,18,"The govt was never supposed to be this big Krystal. It’s inflated to all hell and we pay the price everyday. The only way is to pull the plug, feel some pain during restructuring, and in the long run, have a limited govt that protects our constitutional rights and from foreign attack. We don’t need a dept of education or Medicaid, as it’s shown to have squandered money and not provide all that’s needed. Sorry, time to drive away and not look in the mirror. The last 40 years of politics proves this.",2025-03-12T15:17:12.000Z,"{'label': 'negative', 'score': 0.8843438625335693}",2,0
539,18099300952518531,2,True,False,False,0,Socialism for the rich? What is that? Is poor people’s money being taken by force and given to the rich?,2025-03-13T01:04:51.000Z,"{'label': 'negative', 'score': 0.6978431344032288}",0,0
540,18063653221945760,2,True,False,False,0,dear Krystal ball  im a potential governor candidate for ohio in the democrat primary in 2007 my father got seriously injured at work and long story short the company and handful of doctors and the state of ohio attempted to cover it up i would like to know if you would like to interview us for perfectunion to get the story out their i believe it can connect with many folks from where i live and have lived my whole life the mahoning valley and think i can really have an interesting campaign but need help if everyone can make sure krystal see this i would be in your debt,2025-03-17T23:55:46.000Z,"{'label': 'neutral', 'score': 0.6412647366523743}",3,1
541,18176698771316972,3,False,True,False,0,"The Russians are in the comments section, jeez.",2025-03-13T08:33:58.000Z,"{'label': 'negative', 'score': 0.7175037860870361}",1,0
542,18081133774572603,2,True,False,False,0,Have you had @garyseconomics on for a chat yet? I feel like it would be a great discussion.,2025-03-16T17:14:17.000Z,"{'label': 'positive', 'score': 0.937709629535675}",1,0
543,18496883734003237,209,False,False,False,12,Why is he even speaking,2025-04-15T23:57:23.000Z,"{'label': 'negative', 'score': 0.5666782855987549}",0,0
544,18067599277934810,219,True,True,False,15,Is it just me or i thought we would never see him again until now?,2025-04-15T23:52:08.000Z,"{'label': 'negative', 'score': 0.531351625919342}",2,0
545,18089378287606765,340,False,True,False,4,Very nice they let him out of the nursing home,2025-04-15T23:50:23.000Z,"{'label': 'positive', 'score': 0.9400302171707153}",0,1
546,17843641524458305,1279,True,False,False,46,Now we realize that Trump is the best president in the history of the United States👏🙌,2025-04-15T23:49:26.000Z,"{'label': 'positive', 'score': 0.9750778079032898}",1,0
547,17963081906865688,758,False,True,False,13,We had a dead person in the White House for the last 5 years.,2025-04-15T23:50:52.000Z,"{'label': 'negative', 'score': 0.8315862417221069}",1,0
548,18050463740345679,170,True,False,False,7,Irrelevant and same old same old.,2025-04-15T23:51:59.000Z,"{'label': 'negative', 'score': 0.8914425373077393}",0,0
549,18089511217607167,131,False,True,True,2,Still lying when we know 100% of all crimes under his noise,2025-04-16T00:12:24.000Z,"{'label': 'negative', 'score': 0.7882145643234253}",1,0
550,17912933127070723,15,False,True,False,0,REALLY? They’re still going to parade him out in front of people. You would think they would keep him out of the public eye.,2025-04-16T00:43:13.000Z,"{'label': 'negative', 'score': 0.7066106796264648}",0,1
551,18161956153349650,10,True,False,False,1,Doge found 21M social security numbers being used by dead people...and who are still cashing cheques. Is that funny?,2025-04-16T00:25:09.000Z,"{'label': 'negative', 'score': 0.6172035932540894}",1,0
552,18358176403181992,1602,True,True,False,94,Is he proud of the destruction he caused that Trump now has to clean up?,2025-04-15T23:50:33.000Z,"{'label': 'negative', 'score': 0.8451926708221436}",1,0
553,17968213940856330,72,False,True,False,5,Seeing this face and hearing this voice made me sick to my stomach… just a reminder of how awful the past four years were for our country .,2025-04-15T23:58:36.000Z,"{'label': 'negative', 'score': 0.9596818685531616}",4,0
554,17941783214994425,20,True,True,False,3,Didn’t listen to him before and I’m not gonna listen to him now,2025-04-16T00:04:59.000Z,"{'label': 'negative', 'score': 0.7715771198272705}",0,0
555,18053157389257835,35,True,False,False,0,Thanks for President Trump,2025-04-15T23:59:02.000Z,"{'label': 'positive', 'score': 0.9589000344276428}",0,0
556,18025130915663469,265,False,True,False,2,Go away old man!!! Worst President EVER!!!,2025-04-16T00:08:43.000Z,"{'label': 'negative', 'score': 0.942533016204834}",0,0
557,18060027844893031,35,True,True,False,1,Is he going to end his speech by shaking the hands of imaginary people again?,2025-04-15T23:58:14.000Z,"{'label': 'neutral', 'score': 0.538180410861969}",0,0
558,18060615074011119,213,True,True,False,5,Shapiro be like “hey that was 60 years ago…but God promised this land to me 4000 years ago” 😂 🤡,2025-03-30T15:27:05.000Z,"{'label': 'negative', 'score': 0.5013821721076965}",0,0
559,17843246490452573,131,False,False,False,1,When the finger starts pointing in a direction that's inconvenient...then you don't care,2025-03-30T13:35:24.000Z,"{'label': 'negative', 'score': 0.6959336400032043}",0,0
560,18003922502729888,150,False,True,False,0,Of course Shapiro doesn't care about JFK or the USS Liberty....,2025-03-30T13:54:11.000Z,"{'label': 'negative', 'score': 0.6725842952728271}",1,0
561,17873417550222771,1,True,False,False,0,I LIVE FOR THE POUND!,2025-03-30T13:51:37.000Z,"{'label': 'positive', 'score': 0.9706003665924072}",0,0
562,18038980940447241,1,True,False,False,1,"Saagar- I love you so much HOWEVER stop trying to ban alcohol and weed. You hate the smell of pot?! Well it’s legalized in my state and everyone vapes it and there is hardly a smell. And also, not everyone who drinks is a drunk. 😒 it’s ok to have wine on a Friday Saagar",2025-04-01T13:07:16.000Z,"{'label': 'negative', 'score': 0.5223267078399658}",1,0
563,18068143867913830,3,True,True,False,0,You have been living in a soft coup since 1963,2025-03-30T15:50:27.000Z,"{'label': 'negative', 'score': 0.8492639660835266}",0,0
564,18219977311295322,1,True,True,False,0,There’s a certain group of people that really want to downplay this story and Ben is among that group.,2025-03-31T01:30:40.000Z,"{'label': 'negative', 'score': 0.8411207795143127}",0,0
565,18059062421027614,0,True,True,False,0,If the CIA had the best interest f the USA or where controlled by USA … would this be a valid plan to achieve those goals?,2025-03-30T14:08:52.000Z,"{'label': 'neutral', 'score': 0.709083616733551}",0,0
566,18063081553976419,57,False,True,False,0,Something happened from 1939-1945 too. Who cares by this guys logic.,2025-03-30T13:56:01.000Z,"{'label': 'negative', 'score': 0.6482827663421631}",0,0
567,18037814498565857,37,True,True,False,0,"Ben doesn't want us digging cause his ""other"" country was involved and that's where his real allegiance lies.",2025-03-30T14:45:54.000Z,"{'label': 'negative', 'score': 0.8213112950325012}",2,0
568,17847455691440841,26,True,False,False,1,Ben Shapiro has had more rough takes in recent years,2025-03-30T13:40:33.000Z,"{'label': 'negative', 'score': 0.7626872658729553}",0,0
569,18019477460495927,39,True,True,False,3,Ben doesnt care because most likely….,2025-03-30T14:07:07.000Z,"{'label': 'negative', 'score': 0.6451627016067505}",1,0
570,17961427130910017,7,False,True,False,4,"It’s not that it doesn’t matter, but if we’re going to create a graph on its importance today on politics, Epstein would be in the lead and the most urgently necessary to be made public as it contains so many important figures across politics, corporations and celebrities.",2025-03-30T13:49:16.000Z,"{'label': 'neutral', 'score': 0.6855195164680481}",1,0
571,17975991848703120,161,True,False,False,3,Ben Shapiro cares about no history unless it is in regards to Jewish people.,2025-03-30T13:39:19.000Z,"{'label': 'negative', 'score': 0.7775107622146606}",0,0
572,18036282638285093,8,True,True,False,0,I shouldn’t be surprised by Shapiro at this point and yet it’s unbelievable that he’d tell an entire generation to not care about what happened to JFK.@esaagar gets it. I’d get upset but apparently I’m too old.,2025-03-30T13:44:43.000Z,"{'label': 'negative', 'score': 0.8791810274124146}",0,0
573,17940400895997202,14,True,False,False,0,We love and support you Karen,2025-04-16T00:09:01.000Z,"{'label': 'positive', 'score': 0.9413135647773743}",0,0
574,18062254322510995,11,True,False,False,2,none,2025-04-16T00:42:48.000Z,"{'label': 'neutral', 'score': 0.6332381367683411}",0,0
575,18065274853822074,17,True,True,False,0,He did not get hit by a car- ask any ER nurse or paramedic,2025-04-16T00:49:12.000Z,"{'label': 'neutral', 'score': 0.5199235677719116}",0,0
576,18302995690241084,57,True,True,False,13,"Well, I watched the documentary and I’m very pro law-enforcement. My husband was in law-enforcement for 33 years but there’s a lot of unanswered questions and the officer that talks so horribly about her they got fired.",2025-04-16T00:03:11.000Z,"{'label': 'negative', 'score': 0.5203110575675964}",2,1
577,18037266896271887,31,True,False,False,8,Not sure if she did it or not. I just can’t help getting a creepy vibe from her though.,2025-04-16T00:20:58.000Z,"{'label': 'negative', 'score': 0.6422533392906189}",1,0
578,18073106563868511,53,True,True,False,1,I like her attitude 💪,2025-04-15T23:48:13.000Z,"{'label': 'positive', 'score': 0.9709414839744568}",0,0
579,18059881133027622,3,True,True,False,1,She needs to stop talking.,2025-04-16T01:23:53.000Z,"{'label': 'negative', 'score': 0.742344319820404}",0,0
580,18265676557278256,6,True,True,False,3,I’m just learning about this woman. She seems too confident for someone on a murder trial 😆,2025-04-16T02:17:36.000Z,"{'label': 'neutral', 'score': 0.45832088589668274}",1,0
581,18065439326310914,2,True,False,False,0,There are many reasonable doubts to think she's innocent.,2025-04-16T01:50:17.000Z,"{'label': 'negative', 'score': 0.6799460649490356}",0,0
582,18004067291592039,11,True,True,False,2,She was framed,2025-04-16T00:22:25.000Z,"{'label': 'neutral', 'score': 0.5863404273986816}",0,0
583,17903788248114586,35,False,True,False,0,She's innocent,2025-04-16T00:10:23.000Z,"{'label': 'neutral', 'score': 0.5298410654067993}",0,0
584,18169430623327956,4,True,True,False,3,I think she did it but could it possibly been a mistake? They were both drinking pretty much that night so when she dropped him off maybe she did it and didn’t realize it. She went to his house slept a bit and sobered up a bit and then thought where’s John?,2025-04-16T03:01:21.000Z,"{'label': 'neutral', 'score': 0.7400627732276917}",3,0
585,18142547398391188,1,True,True,False,0,I think she was framed,2025-04-16T05:14:56.000Z,"{'label': 'neutral', 'score': 0.5476217269897461}",0,0
586,18038174513555009,4,False,True,False,0,She's shady!!!,2025-04-16T01:02:00.000Z,"{'label': 'negative', 'score': 0.8580325245857239}",0,0
587,18046815290376919,1,False,True,False,0,@shes guilty i,2025-04-16T07:57:27.000Z,"{'label': 'negative', 'score': 0.4852398931980133}",0,0
588,18108036058394798,167,True,False,True,2,Vegan collagen for sale now (it’s made from cows that are vegan) Link in bio. Use code cow for 15% off your first order,2024-06-29T01:04:49.000Z,"{'label': 'positive', 'score': 0.6145870685577393}",1,0
589,18276365941265097,0,False,True,False,0,Funny Ted,2025-04-15T18:47:33.000Z,"{'label': 'neutral', 'score': 0.44307875633239746}",0,0
590,17929348272020563,0,True,False,False,0,So funny I’m dying laughing. 🥱,2025-04-15T02:45:13.000Z,"{'label': 'positive', 'score': 0.9626572728157043}",0,0
591,18077817871684746,0,True,True,False,0,https://christspiracy.com/,2025-04-13T15:39:08.000Z,"{'label': 'neutral', 'score': 0.850157618522644}",0,0
592,18039498074218767,2,True,True,False,0,"Please don't compare plant based and animal based products. Because when produced in accordance with the necessary humane principles, both sides are healthy and beneficial. In other words, organic and non-GMO plant products are very valuable, as are animal products raised in humane conditions.",2025-04-11T16:52:51.000Z,"{'label': 'positive', 'score': 0.6797884702682495}",1,0
593,18354707485180739,0,True,False,False,0,Full carnivore diet took me from weak and fat to a gawdamm sexual tyrannosaurus. I get everyone I coach to move towards it 🔥,2025-04-10T15:14:12.000Z,"{'label': 'positive', 'score': 0.7133587598800659}",2,0
594,17938893473875001,1,True,True,False,1,@annie_bo_banyantree,2025-04-07T17:16:25.000Z,"{'label': 'neutral', 'score': 0.7912607789039612}",0,0
595,18081089212655473,0,True,True,False,0,😂😂😂😂,2025-04-06T00:23:22.000Z,"{'label': 'neutral', 'score': 0.5487988591194153}",0,0
596,18220084261290318,0,False,False,False,0,So funny 😂,2025-04-05T05:47:42.000Z,"{'label': 'positive', 'score': 0.853344202041626}",0,0
597,18082192294726922,1,True,False,False,0,😂😂,2025-04-04T17:41:27.000Z,"{'label': 'neutral', 'score': 0.5604997277259827}",0,0
598,18167461216331001,0,True,True,False,0,"Las mujeres no son perras, te refieres a las mujeres cómo perras y se vuelven infértiles x culpa del poliéster ......tuviste algún problema en tu infancia , resuelvelo por favor",2025-04-03T18:03:17.000Z,"{'label': 'neutral', 'score': 0.8343303203582764}",0,0
599,18310561600230855,0,True,False,False,0,😂,2025-03-30T10:59:45.000Z,"{'label': 'neutral', 'score': 0.4929787814617157}",0,0
600,18090795127510424,4,True,True,False,0,Don't tell this to Indians 😃,2025-03-29T00:02:50.000Z,"{'label': 'neutral', 'score': 0.5458032488822937}",0,0
601,18062099825477391,0,True,False,False,0,😂,2025-03-28T11:29:36.000Z,"{'label': 'neutral', 'score': 0.4929787814617157}",0,0
602,18074653255642056,0,True,False,False,0,Omg yum gimmi some 🔥😍,2025-03-28T08:26:06.000Z,"{'label': 'positive', 'score': 0.9735757112503052}",0,0
603,18186202810311121,1,True,False,True,0,Diamond and Maldon (smoked) live forever in my pantry.,2025-04-15T19:45:49.000Z,"{'label': 'positive', 'score': 0.721557080745697}",0,0
604,18076530784769737,1,True,False,False,0,This is a reference to lab results posted by mamavation (I think that’s the name) who blocks people who ask for her lab sources and handles how she promotes various brands in sketchy ways.,2025-04-15T17:52:09.000Z,"{'label': 'negative', 'score': 0.6915525794029236}",2,0
605,17916756485980256,2,True,False,False,0,Good day to be a 20 minute drive from Maldon🌀,2025-04-15T21:32:56.000Z,"{'label': 'positive', 'score': 0.9383960962295532}",0,0
606,18072548923866945,45,True,False,False,2,I’m lucky to live in Sardinia and get access to Sardinian sea salt,2025-04-15T16:53:04.000Z,"{'label': 'positive', 'score': 0.9496902227401733}",0,0
607,18076210840760327,3,True,False,True,0,Chef 🧑🏼‍🍳 speaking here and I use MALDON all day everyday!,2025-04-15T17:19:10.000Z,"{'label': 'positive', 'score': 0.7084125876426697}",1,0
608,17862380349384798,3,False,False,False,0,hard to eat healthy in this world...,2025-04-15T16:55:27.000Z,"{'label': 'negative', 'score': 0.7574601173400879}",0,0
609,18102018556518416,1,True,False,False,0,I prefer Fleur de sel.,2025-04-15T19:39:27.000Z,"{'label': 'neutral', 'score': 0.6027160882949829}",0,0
610,18077345662784596,2,True,True,False,1,saltverk icelandic salt!!,2025-04-15T17:56:43.000Z,"{'label': 'neutral', 'score': 0.6673751473426819}",0,0
611,18076109683812646,2,True,False,False,0,none,2025-04-16T01:05:22.000Z,"{'label': 'neutral', 'score': 0.6332381367683411}",0,0
612,18008850698557716,243,True,False,True,19,"As a naturopath specializing in thyroid and gut health, I believe this conversation needs more nuance. While salts like Redmond, Celtic, and Himalayan do contain trace amounts of naturally occurring elements like lead, they also provide a rich spectrum of minerals essential for electrolyte balance and healing—especially for those recovering from chronic illness. There are many products that offer health benefits that have unavoidable levels of certain toxins, it’s why it is wise for many to consider including a binder (such as takesumi supreme) as part of a daily supplement stack. Notably, Redmond Real Salt is sourced from an ancient seabed, making it free from modern pollutants like microplastics . In contrast, salts such as David’s or Diamond Crystal are highly refined, often stripped of beneficial minerals, and may contain anti-caking agents that can be disruptive to sensitive systems. Maldon is a cleaner, additive-free option with a beautiful flake texture, but it lacks the mineral richness found in unrefined salts. For those seeking both purity and mineral density, Makai Pure from Selina Naturally is an excellent choice, tested free of detectable lead. Choosing salt isn’t just about what to avoid—it’s about selecting options that support the body’s healing processes.",2025-04-15T17:43:51.000Z,"{'label': 'neutral', 'score': 0.7416169047355652}",2,1
613,17884943100256019,3,True,True,False,1,Is Celtic gray salt ok? Le marinier salt??,2025-04-15T16:53:36.000Z,"{'label': 'neutral', 'score': 0.8461498022079468}",0,0
614,17897213961189483,41,True,False,False,1,Dipping the steak in the sea is peak carnivore,2025-04-15T17:01:51.000Z,"{'label': 'neutral', 'score': 0.6298627853393555}",0,0
615,18305182570235778,68,True,False,False,12,Aren’t those “studies” from mama wellness? Didn’t she refuse to answer any questions about what lab was used? And gets payed to promote “healthy brands” ??,2025-04-15T17:09:15.000Z,"{'label': 'negative', 'score': 0.6931992173194885}",4,0
616,18085861978620240,27,True,False,False,1,I get French grey sea salt at the organic farmers market 🙌,2025-04-15T16:41:31.000Z,"{'label': 'positive', 'score': 0.9653892517089844}",0,0
617,18099483520474832,1,True,True,False,1,Thoughts on Jacobson Co Oregon Salt? Tests show it has non-detect heavy metals.,2025-04-15T17:16:44.000Z,"{'label': 'neutral', 'score': 0.749077558517456}",0,0
618,18091586851579729,4,False,True,False,1,🙏🏻🙏🏻,2025-04-16T02:20:47.000Z,"{'label': 'positive', 'score': 0.8145216107368469}",0,0
619,17984325209671241,6,False,True,False,1,❤️❤️❤️🙏🙏🙏,2025-04-16T05:54:07.000Z,"{'label': 'positive', 'score': 0.9467498660087585}",0,0
620,17996657078784943,0,True,True,False,1,"Rachel Morin’s Mother: There are many who see you, hear you, & pray for you & yours❣️God bless you! 🙌",2025-04-16T08:48:39.000Z,"{'label': 'positive', 'score': 0.9733730554580688}",1,0
621,18168335146330315,117,False,True,False,2,Bless your heart.  And those of your 5 grandchildren 🙏🏻🙏🏻🙏🏻,2025-04-16T02:18:09.000Z,"{'label': 'positive', 'score': 0.9372329711914062}",2,0
622,17860131249331424,19,True,True,False,0,"So sad! My heart breaks for her, many many prayers 🙏💔",2025-04-16T02:43:49.000Z,"{'label': 'negative', 'score': 0.874031126499176}",0,0
623,18152954758364940,8,True,False,False,0,I pray for your peace 🙏🏻,2025-04-16T05:08:03.000Z,"{'label': 'positive', 'score': 0.736939013004303}",1,0
624,18478311625064071,5,True,True,False,1,I’m so sorry. ❤️,2025-04-16T03:48:17.000Z,"{'label': 'negative', 'score': 0.6637299656867981}",0,0
625,18102157012514025,34,True,False,False,0,Prayers for you & your continued strength. 🙏🏼,2025-04-16T02:44:09.000Z,"{'label': 'positive', 'score': 0.8994988203048706}",1,0
626,18098908267524251,20,True,False,False,1,Well said. Bless you.,2025-04-16T06:45:33.000Z,"{'label': 'positive', 'score': 0.9253014326095581}",0,0
627,18111825724467470,11,True,True,False,1,Hello everyone. So sad 😢,2025-04-16T03:17:24.000Z,"{'label': 'negative', 'score': 0.9187790751457214}",0,0
628,18045854438112584,197,True,False,False,34,"Liberals, for some reason, always sympathize with the criminals instead of the victims. It’s so odd; I’ll never understand it.",2025-04-16T02:17:46.000Z,"{'label': 'negative', 'score': 0.9227317571640015}",0,0
629,18082638790726423,14,True,True,False,0,My ❤️hurts for this woman and family 😢😢😢,2025-04-16T02:41:50.000Z,"{'label': 'negative', 'score': 0.8744112253189087}",0,0
630,18495508594032116,35,True,False,False,1,Prayers to the family 😢,2025-04-16T02:21:40.000Z,"{'label': 'negative', 'score': 0.47318652272224426}",0,0
631,17923311522064012,16,True,False,False,2,Life is not easy or fair but to think that that catastrophe could have been avoided if Biden had not been elected president or at least had tried to do the job he was elected to do!! It is nothing but a shame!!,2025-04-16T05:50:21.000Z,"{'label': 'negative', 'score': 0.9207350611686707}",0,0
632,18370182235135624,17,True,True,False,0,GOD is n control 🙏🏼❤️GOD loves us and HE lets us pick GOD or Satan🙏🏼,2025-04-16T02:20:35.000Z,"{'label': 'positive', 'score': 0.9597858786582947}",2,0
633,18365578963126059,2,False,True,False,0,It The Barrio,2025-04-16T01:59:42.000Z,"{'label': 'neutral', 'score': 0.856853187084198}",0,0
634,18057744061901019,15,True,False,False,2,Can someone explain to me what part of this is satire?,2025-04-15T23:34:30.000Z,"{'label': 'negative', 'score': 0.6467985510826111}",0,0
635,17938186532882073,1,True,False,False,0,💩💩,2025-04-15T19:36:34.000Z,"{'label': 'negative', 'score': 0.7391921281814575}",0,0
636,17941443812858522,0,False,True,False,0,Be a voice not an echo🧡,2025-04-15T19:06:52.000Z,"{'label': 'positive', 'score': 0.6657252907752991}",0,0
637,18006245546729314,5,False,True,False,0,Will they get due process?,2025-04-16T01:21:31.000Z,"{'label': 'neutral', 'score': 0.6386810541152954}",0,1
638,17950498805953212,146,True,False,False,10,What about himself?,2025-04-16T00:25:46.000Z,"{'label': 'neutral', 'score': 0.8427345752716064}",0,0
639,17976914882704063,21,True,False,False,0,Hopefully he sends himself to El Salvador,2025-04-16T00:57:16.000Z,"{'label': 'negative', 'score': 0.5249900221824646}",0,0
640,18292209658218922,3,True,False,False,0,Like you,2025-04-16T04:09:03.000Z,"{'label': 'neutral', 'score': 0.510862410068512}",0,0
641,18128844514416521,34,True,False,False,0,You mean citizens?,2025-04-16T02:01:55.000Z,"{'label': 'neutral', 'score': 0.7852925658226013}",0,0
642,18082981327641640,79,True,True,False,3,"Like the ones he pardon, those home grown",2025-04-16T00:37:26.000Z,"{'label': 'neutral', 'score': 0.7519690990447998}",0,0
643,18038046329560795,3,True,False,False,0,Best President ever!!,2025-04-16T02:39:47.000Z,"{'label': 'positive', 'score': 0.976525604724884}",0,0
644,17905146027137348,12,True,True,False,6,That’s my President! ❤️🤍💙 the best president of united state of America 🇺🇸 cry about it. ✌🏼✌🏼 you guys can’t keep trumps name of your mouth so he’s doing a great job . We voted for who we wanted & that is Donald J Trump the best man to do it.,2025-04-16T00:34:16.000Z,"{'label': 'positive', 'score': 0.9596186280250549}",2,0
645,17870187468345782,2,True,True,False,0,He really is right about these facts,2025-04-16T01:53:36.000Z,"{'label': 'positive', 'score': 0.7574272155761719}",0,0
646,18039391118532937,98,True,True,False,13,To ship US citizens to other countries for penalty? Do you understand how ridiculously dangerous of a precedent this is to set??,2025-04-16T00:23:43.000Z,"{'label': 'negative', 'score': 0.9252156019210815}",2,0
647,18064968248494777,13,True,True,False,1,What is wrong with humans?,2025-04-16T00:23:58.000Z,"{'label': 'negative', 'score': 0.9250823855400085}",0,0
648,18156366640360259,54,True,True,False,3,The rule of law doesn't apply anymore if Trump gets away with defying a 9-0 supreme court ruled order.,2025-04-16T00:58:54.000Z,"{'label': 'negative', 'score': 0.6558622717857361}",1,0
649,18042981296389273,2,True,True,False,3,If your convicted of a crime you had due process.,2025-04-16T00:54:38.000Z,"{'label': 'neutral', 'score': 0.6532393097877502}",1,0
650,18064048390839963,94,True,True,False,2,"The irony of a Trump, a 34x convicted felon by a jury of his peers, talking about “home grown criminals” is stunning and deeply concerning.  Beyond that, he is assuming the role of judicial which is unconstitutional.",2025-04-16T00:50:02.000Z,"{'label': 'negative', 'score': 0.908444344997406}",0,0
651,17928506046029067,204,True,False,False,24,Trump has 34 felonies convictions,2025-04-16T00:27:59.000Z,"{'label': 'negative', 'score': 0.637139618396759}",0,0
652,18161127751356578,21,True,False,False,1,"Carnivore way of eating changed my life in that regard. More grounded, more present, and surprisingly more connected.",2025-04-14T18:51:02.000Z,"{'label': 'positive', 'score': 0.9161577820777893}",0,0
653,18025844537438360,3,True,False,False,0,Doing what I can as a woman to be an advocate for men’s mental and physical health without seeming like I’m shaming them. Committed to spreading love and awareness baby!,2025-04-14T19:47:20.000Z,"{'label': 'positive', 'score': 0.7326199412345886}",0,1
